{
  "schemaVersion": "approach-challenge-problem-v1",
  "problemId": "acm-b05-01",
  "problemVersion": "1",
  "trackId": "coding-interview-dsa-problem-solving",
  "primaryFamilyId": "sliding_window",
  "requiredFamilyIds": [
    "sliding_window"
  ],
  "difficulty": "medium",
  "approachQuestion": {
    "questionId": "acm-b05-01-q1",
    "trackId": "coding-interview-dsa-problem-solving",
    "nodeId": "sliding_window",
    "mentalUnitId": "variable_size_monotonic_window",
    "prompt": "Shortest Delivery Segment\n\nThe array `deliveries` contains positive amounts from consecutive deliveries. Return the length of the shortest non-empty contiguous segment whose sum is at least `target`. Return 0 if no such segment exists. Keep the deliveries in their original order. Return only the length.\n\nLimits and assumptions:\n• 1 ≤ n ≤ 200000; 1 ≤ deliveries[i] ≤ 1000000; 1 ≤ target ≤ 10^12.\n• Every value is strictly positive; sums fit in a 64-bit integer.\n• The segment must be contiguous and non-empty.\n\nExamples:\n1. deliveries = [3,1,4,2,6], target = 8 → 2, for [2,6].\n2. deliveries = [2,2,2], target = 7 → 0.\n\nChoose one approach.",
    "constraints": [
      "1 ≤ n ≤ 200000; 1 ≤ deliveries[i] ≤ 1000000; 1 ≤ target ≤ 10^12.",
      "Every value is strictly positive; sums fit in a 64-bit integer.",
      "The segment must be contiguous and non-empty."
    ],
    "difficulty": "medium",
    "interaction": {
      "type": "approach_choice",
      "scoringMethod": "graded_option",
      "options": [
        {
          "optionId": "A",
          "approachId": "shrink-positive-window",
          "text": "Move the right boundary and add each delivery to the sum. Whenever the sum reaches the target, record the length and move the left boundary while the segment still meets the target.",
          "grade": "correct",
          "feedback": "Positive values make the sum non-decreasing when the segment grows and non-increasing when it shrinks from the left. These directions make both boundary moves safe."
        },
        {
          "optionId": "B",
          "approachId": "prefix-binary-search",
          "text": "Build increasing prefix sums, then use binary search for the first qualifying end for each start.",
          "grade": "partial",
          "feedback": "This works for every positive input and uses the increasing prefix sums, but it searches for the end separately for each start."
        },
        {
          "optionId": "C",
          "approachId": "enumerate-fragments",
          "text": "For each start, add the following deliveries until the sum reaches the target or the array ends; keep the shortest qualifying length.",
          "grade": "incorrect",
          "feedback": "The result is correct, but long segments are checked again for many different starts even though their boundaries can move together."
        },
        {
          "optionId": "D",
          "approachId": "sort-largest-deliveries",
          "text": "Sort deliveries from largest to smallest and choose the fewest largest values whose sum reaches the target.",
          "grade": "incorrect",
          "feedback": "Sorting loses the contiguity requirement. For [6,1,6] with target 12, the answer is 3; choosing the two largest deliveries does not form a contiguous segment."
        }
      ]
    },
    "answer": {
      "type": "approach_choice"
    },
    "feedback": {
      "type": "approach_choice",
      "reason": "Check whether the window property and the boundary movements match the exact task conditions.",
      "details": {}
    }
  },
  "complexityQuestion": {
    "questionId": "acm-b05-01-q2",
    "trackId": "coding-interview-dsa-problem-solving",
    "nodeId": "sliding_window",
    "mentalUnitId": "variable_size_monotonic_window",
    "prompt": "For the method “Move the right boundary and shrink the positive window,” choose one pair: running time and additional space.",
    "difficulty": "medium",
    "constraints": [
      "Analyze only the named method. Do not count the input or returned value as additional space.",
      "There is no recursion or call stack."
    ],
    "interaction": {
      "type": "choice_single",
      "scoringMethod": "exact_selected_set",
      "options": [
        {
          "optionId": "linear-constant",
          "text": "O(n) time, O(1) additional space"
        },
        {
          "optionId": "linear-array",
          "text": "O(n) time, O(n) additional space"
        },
        {
          "optionId": "nlogn-linear",
          "text": "O(n log n) time, O(n) additional space"
        },
        {
          "optionId": "quadratic-constant",
          "text": "O(n²) time, O(1) additional space"
        }
      ]
    },
    "answer": {
      "type": "choice_single",
      "optionId": "linear-constant"
    },
    "feedback": {
      "type": "choice_single",
      "reason": "Each value enters the window at most once and leaves it at most once. The method stores the boundaries, current sum, and best length.",
      "details": {
        "time": "O(n)",
        "additionalSpace": "O(1)",
        "correctness": "Because every value is positive, extending the window cannot decrease its sum, and removing the leftmost value cannot increase it. Once the sum reaches the target, shrinking checks the shorter qualifying starts for that right boundary; discarded starts cannot later produce a better answer.",
        "alternatives": "Prefix sums with a separate search for each start are correct, but perform repeated searches. Enumerating starts and ends repeats work. Sorting breaks contiguity. The proof depends on strictly positive values: with arbitrary negative values, a boundary move can have the opposite effect. For example, [5,-10,8] contains the one-element segment [8] meeting target 7, even though the running prefix never reaches the target."
      }
    }
  },
  "analyzedApproachId": "shrink-positive-window",
  "methodReveal": {
    "title": "A positive window with moving boundaries",
    "description": "Add deliveries from the right and keep their sum. Whenever the sum reaches the target, record the length, then remove values from the left while the remaining segment still meets the target."
  }
}
