{
  "schemaVersion":"approach-challenge-problem-v1","problemId":"acm-b01-02","problemVersion":"1","trackId":"coding-interview-dsa-problem-solving","primaryFamilyId":"complexity_and_constraints","requiredFamilyIds":["complexity_and_constraints"],"difficulty":"easy",
  "approachQuestion":{"questionId":"acm-b01-02-q1","trackId":"coding-interview-dsa-problem-solving","nodeId":"complexity_and_constraints","mentalUnitId":"preprocessing-amortized-across-queries","prompt":"Many range totals on a fixed array. Return one sum for each inclusive query [left,right]. The immutable array has n values (1 <= n <= 100,000), and there are q queries (10,000 <= q <= 100,000); endpoints are valid and each answer fits in signed 64-bit. Example: values=[2,5,-1,4], queries=[[0,2],[1,3],[2,2]] returns [6,8,-1]. Choose a method for the stated large query workload.","constraints":["All queries use the same unchanged array.","The output contains q sums and is excluded from auxiliary-space accounting.","Input is read-only; every prefix sum, not only requested answers, fits signed 64-bit; addition is constant time."],"difficulty":"easy","interaction":{"type":"approach_choice","scoringMethod":"graded_option","options":[{"optionId":"A","approachId":"prefix-sums-for-many-ranges","text":"Make cumulative totals once, then answer each range by subtracting two stored totals (with a zero before the first element).","grade":"correct","feedback":"The one-time summary is reused by every query, and subtraction handles both endpoints consistently."},{"optionId":"B","approachId":"rescan-each-range","text":"For every query, add all entries between its endpoints from the original array.","grade":"incorrect","feedback":"This is correct but repeats work; with n=q=100,000 and full-length ranges it visits about ten billion entries."},{"optionId":"C","approachId":"prefix-without-boundary","text":"Store cumulative totals starting at index zero, then always subtract prefix[left] from prefix[right].","grade":"incorrect","feedback":"It omits values[left]. For values=[2,5,-1,4] and query [1,3], it returns 3 instead of 8."},{"optionId":"D","approachId":"sort-before-prefix","text":"Sort the values first, then build cumulative totals and use the original endpoints.","grade":"incorrect","feedback":"For values=[2,5,-1,4] and range [1,3], sorting gives [-1,2,4,5], whose positions 1..3 sum to 11 rather than the original range sum 8."}]},"answer":{"type":"approach_choice"},"feedback":{"type":"approach_choice","reason":"A summary pays off when many queries reuse the same unchanged input.","details":{}}},
  "complexityQuestion":{"questionId":"acm-b01-02-q2","trackId":"coding-interview-dsa-problem-solving","nodeId":"complexity_and_constraints","mentalUnitId":"preprocessing-amortized-across-queries","prompt":"Choose the time and auxiliary-space pair for prefix-sums-for-many-ranges. The q returned sums are output and excluded from auxiliary space.","difficulty":"easy","constraints":["n is the array length and q is the query count.","The cumulative table has one entry per input position plus a leading zero."],"interaction":{"type":"choice_single","scoringMethod":"exact_selected_set","options":[{"optionId":"n-plus-q-linear","text":"O(n + q) time, O(n) auxiliary space"},{"optionId":"nq-linear","text":"O(nq) time, O(1) auxiliary space"},{"optionId":"n-plus-q-constant","text":"O(n + q) time, O(1) auxiliary space"}]},"answer":{"type":"choice_single","optionId":"n-plus-q-linear"},"feedback":{"type":"choice_single","reason":"The cumulative table is built in one pass, then each query takes constant work. The table remains live and has linear size; the output array is excluded.","details":{"time":"O(n + q)","additionalSpace":"O(n)"}}},
  "analyzedApproachId":"prefix-sums-for-many-ranges","methodReveal":{"title":"Reuse cumulative totals","description":"Build prefix[0]=0 and prefix[i+1]=prefix[i]+values[i]. For each inclusive range, return prefix[right+1]-prefix[left]. The extra leading zero makes ranges beginning at index zero use the same formula."}
}
