{
  "schemaVersion": "approach-challenge-problem-v1",
  "problemId": "ACM-B05-01",
  "problemVersion": "1",
  "trackId": "coding-interview-dsa-problem-solving",
  "primaryFamilyId": "sliding_window",
  "requiredFamilyIds": ["sliding_window"],
  "difficulty": "medium",
  "approachQuestion": {
    "questionId": "ACM-B05-01-Q1",
    "trackId": "coding-interview-dsa-problem-solving",
    "nodeId": "sliding_window",
    "mentalUnitId": "monotone-fragment",
    "prompt": "Find the shortest non-empty contiguous fragment whose sum reaches the target.",
    "constraints": ["Every value is positive."],
    "difficulty": "medium",
    "interaction": {
      "type": "approach_choice",
      "scoringMethod": "graded_option",
      "options": [
        { "optionId": "A", "approachId": "shrink-window", "text": "Extend right and shrink left while the sum still reaches the target.", "grade": "correct", "feedback": "Positive values let both boundaries move forward safely." },
        { "optionId": "B", "approachId": "prefix-search", "text": "Build prefix sums and binary-search an end for each start.", "grade": "partial", "feedback": "Monotonicity is used, but repeated searches do extra work." },
        { "optionId": "C", "approachId": "all-fragments", "text": "Check every possible start and end pair.", "grade": "incorrect", "feedback": "The result is correct, but the same values are revisited many times." }
      ]
    },
    "answer": { "type": "approach_choice" },
    "feedback": { "type": "approach_choice", "reason": "The domain restriction determines which boundaries can move safely.", "details": {} }
  },
  "complexityQuestion": {
    "questionId": "ACM-B05-01-Q2",
    "trackId": "coding-interview-dsa-problem-solving",
    "nodeId": "sliding_window",
    "mentalUnitId": "monotone-fragment",
    "prompt": "Choose the time and additional-space pair for the shrinking window.",
    "difficulty": "medium",
    "interaction": { "type": "choice_single", "scoringMethod": "exact_selected_set", "options": [{ "optionId": "linear-constant", "text": "O(n) time, O(1) additional space" }, { "optionId": "quadratic-constant", "text": "O(n²) time, O(1) additional space" }] },
    "answer": { "type": "choice_single", "optionId": "linear-constant" },
    "feedback": { "type": "choice_single", "reason": "Each boundary crosses the array at most once.", "details": { "time": "O(n)", "additionalSpace": "O(1)" } }
  },
  "analyzedApproachId": "shrink-window",
  "methodReveal": { "title": "Maintain a valid window", "description": "Add values on the right, then advance the left boundary while the remaining window still satisfies the target." }
}
