{
  "schemaVersion": "approach-challenge-problem-v1",
  "problemId": "ACM-B02-01",
  "problemVersion": "1",
  "trackId": "coding-interview-dsa-problem-solving",
  "primaryFamilyId": "arrays_and_strings",
  "requiredFamilyIds": ["arrays_and_strings"],
  "difficulty": "easy",
  "approachQuestion": {
    "questionId": "ACM-B02-01-Q1",
    "trackId": "coding-interview-dsa-problem-solving",
    "nodeId": "arrays_and_strings",
    "mentalUnitId": "neighbor-state",
    "prompt": "Find the largest absolute difference between adjacent readings.",
    "constraints": ["The input order must remain unchanged."],
    "difficulty": "easy",
    "interaction": {
      "type": "approach_choice",
      "scoringMethod": "graded_option",
      "options": [
        { "optionId": "A", "approachId": "scan-neighbors", "text": "Scan each adjacent pair and keep the largest difference.", "grade": "correct", "feedback": "One running maximum is enough." },
        { "optionId": "B", "approachId": "store-differences", "text": "Store every adjacent difference, then find the maximum.", "grade": "partial", "feedback": "The correct pairs are compared, but the stored list is unnecessary." },
        { "optionId": "C", "approachId": "sort-first", "text": "Sort the readings, then compare adjacent values.", "grade": "incorrect", "feedback": "Sorting changes which readings were adjacent." }
      ]
    },
    "answer": { "type": "approach_choice" },
    "feedback": { "type": "approach_choice", "reason": "Choose a method that respects the original order.", "details": {} }
  },
  "complexityQuestion": {
    "questionId": "ACM-B02-01-Q2",
    "trackId": "coding-interview-dsa-problem-solving",
    "nodeId": "arrays_and_strings",
    "mentalUnitId": "neighbor-state",
    "prompt": "Choose the time and additional-space pair for the single-pass method.",
    "difficulty": "easy",
    "interaction": { "type": "choice_single", "scoringMethod": "exact_selected_set", "options": [{ "optionId": "linear-constant", "text": "O(n) time, O(1) additional space" }, { "optionId": "sort-copy", "text": "O(n log n) time, O(n) additional space" }] },
    "answer": { "type": "choice_single", "optionId": "linear-constant" },
    "feedback": { "type": "choice_single", "reason": "The pass reads each neighbor pair once and retains constant state.", "details": { "time": "O(n)", "additionalSpace": "O(1)" } }
  },
  "analyzedApproachId": "scan-neighbors",
  "methodReveal": { "title": "One running maximum", "description": "Compare each adjacent pair and update the best difference as you move across the input." }
}
